{"schema":"fsgg.workspace.result/1","commandId":"11111111-2222-3333-4444-555555555555","workflowRevision":"41","fenceGeneration":"9","completedAt":"2026-09-30T12:34:56.789123Z","exitCode":{"state":"unknown","reason":"process-lost-before-readback"},"artifactReference":{"state":"missing","reason":"no-verified-artifact-observed"},"error":{"code":"execution-outcome-unknown","message":"The execution outcome could not be established from durable evidence.","retryable":true,"details":{"provider":"isolated-runner"}}}
